{
  "meta": {
    "title": "Nested Circles and Shaded Areas",
    "source": "Problem Statement: An even number of circles are nested, starting with a radius of 1 and increasing by 1 each time, all sharing a common point. The region between every other circle is shaded, starting with the region inside the circle of radius 2 but outside the circle of radius 1. An example showing 8 circles is displayed below. What is the least number of circles needed to make the total shaded area at least 2023π?",
    "answer": "64",
    "estimated_duration_minutes": 15
  },
  "problem": {
    "text": "An even number of circles are nested, starting with a radius of $1$ and increasing by $1$ each time, all sharing a common point. The region between every other circle is shaded, starting with the region inside the circle of radius $2$ but outside the circle of radius $1$. An example showing $8$ circles is displayed below. What is the **least number of circles** needed to make the total shaded area at least $2023\\pi$?",
    "highlight": "Find the least number of nested circles where the total shaded area between every other circle is at least 2023π."
  },
  "viz_requirements": {
    "type": "custom",
    "description": "Visualization of nested circles with shaded annular regions, algebraic expansion of ring areas, series summation visualization, and quadratic inequality solving.",
    "config": {
      "viewBox": "0 0 600 400",
      "initialRadius": 1,
      "maxCircles": 10
    },
    "actions": [
      {
        "method": "drawCircle",
        "description": "Draw a circle with the given radius and color. If shaded is true, fills the ring between this circle and the previous one.",
        "params_schema": {
          "radius": "number",
          "color": "string",
          "shaded": "boolean"
        }
      },
      {
        "method": "showAlgebraStep",
        "description": "Displays the algebraic expansion of (2k)^2 - (2k-1)^2 step-by-step.",
        "params_schema": {
          "expression": "string",
          "step": "number"
        }
      },
      {
        "method": "showSeriesSum",
        "description": "Visualizes the summation ∑(4k - 1)π as it builds up.",
        "params_schema": {
          "n": "number"
        }
      },
      {
        "method": "plotQuadratic",
        "description": "Plots y = ax^2 + bx + c and highlights the solution at highlightX.",
        "params_schema": {
          "a": "number",
          "b": "number",
          "c": "number",
          "highlightX": "number"
        }
      },
      {
        "method": "highlightAnswer",
        "description": "Emphasizes the final answer (e.g., '64') with a visual effect.",
        "params_schema": {
          "value": "number"
        }
      }
    ]
  },
  "nodes": [
    {
      "type": "act",
      "id": "act_setup",
      "title": "Problem Setup",
      "objective": "Understand the shading pattern and the setup of the circles.",
      "context_from_previous": "Student is introduced to the problem of nested circles with alternating shaded rings.",
      "beat_outline": [
        {
          "narration_hint": "Introduce the problem with the visual of nested circles and the shading pattern.",
          "card_type": "title",
          "viz_actions": [
            "drawCircle"
          ],
          "inline_at_end": false
        },
        {
          "narration_hint": "Show the first two shaded rings (between 2 & 1, and between 4 & 3) in a distinct color.",
          "card_type": "none",
          "viz_actions": [
            "drawCircle"
          ],
          "inline_at_end": false
        }
      ],
      "viz_panel": "svg"
    },
    {
      "type": "act",
      "id": "act_calculate_ring",
      "title": "Calculating Ring Areas",
      "objective": "Derive the area of one shaded ring.",
      "context_from_previous": "Student has seen the nested circles with the first two shaded rings highlighted.",
      "beat_outline": [
        {
          "narration_hint": "Focus on one ring, show the area calculation.",
          "card_type": "latex",
          "viz_actions": [
            "showAlgebraStep"
          ],
          "inline_at_end": false
        },
        {
          "narration_hint": "Animate the algebraic expansion from (2k)^2 - (2k-1)^2 to (4k - 1)π.",
          "card_type": "derivation",
          "viz_actions": [
            "showAlgebraStep"
          ],
          "inline_at_end": false
        }
      ],
      "viz_panel": "svg"
    },
    {
      "type": "gate",
      "id": "gate_ring_area",
      "gate_type": "fill-in",
      "after_act": "act_calculate_ring",
      "question_hint": "What is the area of the ring between radius 4 and radius 3?",
      "wrong_path_hint": "Remember to subtract the area of the smaller circle from the larger one.",
      "wrong_path_acts": [
        {
          "type": "act",
          "id": "act_wrong_path_ring",
          "title": "Reinforce Ring Area Calculation",
          "objective": "Correctly calculate the area of a shaded ring.",
          "context_from_previous": "Student incorrectly calculated the area of a shaded ring.",
          "beat_outline": [
            {
              "narration_hint": "Re-explain the area calculation for a shaded ring.",
              "card_type": "latex",
              "viz_actions": [
                "showAlgebraStep"
              ],
              "inline_at_end": false
            }
          ],
          "viz_panel": "svg"
        }
      ]
    },
    {
      "type": "act",
      "id": "act_sum_series",
      "title": "Summing the Series",
      "objective": "Sum the series of shaded areas.",
      "context_from_previous": "Student has derived the formula for the area of the k-th shaded ring.",
      "beat_outline": [
        {
          "narration_hint": "Show the series Sn = 3π + 7π + 11π + ... + (4n-1)π.",
          "card_type": "latex",
          "viz_actions": [
            "showSeriesSum"
          ],
          "inline_at_end": false
        },
        {
          "narration_hint": "Break down the summation into 4∑k - ∑1 and simplify to 2n^2 + n.",
          "card_type": "derivation",
          "viz_actions": [
            "showSeriesSum"
          ],
          "inline_at_end": false
        }
      ],
      "viz_panel": "svg"
    },
    {
      "type": "act",
      "id": "act_solve_inequality",
      "title": "Solving the Inequality",
      "objective": "Find the smallest n such that Sn ≥ 2023π.",
      "context_from_previous": "Student has the total shaded area formula Sn = π(2n^2 + n).",
      "beat_outline": [
        {
          "narration_hint": "Plot the quadratic function y = 2n^2 + n - 2023.",
          "card_type": "plot-2d",
          "viz_actions": [
            "plotQuadratic"
          ],
          "inline_at_end": false
        },
        {
          "narration_hint": "Highlight the root at n ≈ 31.555 and the integer points n = 31 and n = 32.",
          "card_type": "none",
          "viz_actions": [
            "plotQuadratic"
          ],
          "inline_at_end": false
        }
      ],
      "viz_panel": "svg"
    },
    {
      "type": "act",
      "id": "act_conclusion",
      "title": "Conclusion",
      "objective": "Present the final answer.",
      "context_from_previous": "Student has solved the inequality and verified the answer.",
      "beat_outline": [
        {
          "narration_hint": "Display the conclusion with 2n = 64 circles.",
          "card_type": "recap",
          "viz_actions": [
            "highlightAnswer"
          ],
          "inline_at_end": false
        }
      ],
      "viz_panel": "svg"
    },
    {
      "type": "marker",
      "label": "End of Lesson",
      "after_act": "act_conclusion"
    }
  ]
}