{
  "meta": {
    "title": "Nested Rings and Quadratic Growth",
    "source": "Adapted from AMC problem",
    "answer": "32",
    "estimated_duration_minutes": 8
  },
  "problem": {
    "text": "An even number of circles are nested, starting with radius $1$ and increasing by $1$ each time. The region between every other circle is shaded, starting with the area between radius $1$ and $2$. What is the **least number of circles** needed to make the total shaded area at least $2023\\pi$?",
    "highlight": "Find minimum circles where alternating ring areas sum to ≥2023π"
  },
  "viz_requirements": {
    "type": "custom",
    "description": "Concentric circles with alternating shaded rings that transform into quadratic growth visualization",
    "config": {
      "max_circles": 40,
      "initial_n": 8
    },
    "actions": [
      {
        "method": "drawCircle",
        "description": "Draw a circle with specified radius",
        "params_schema": {
          "radius": "number",
          "color": "string"
        }
      },
      {
        "method": "highlightRing",
        "description": "Fill the area between two consecutive circles",
        "params_schema": {
          "k": "number",
          "color": "string"
        }
      },
      {
        "method": "showAreaFormula",
        "description": "Display the area formula π(2k+1) next to a ring",
        "params_schema": {
          "k": "number"
        }
      },
      {
        "method": "stackRings",
        "description": "Transform shaded rings into vertical rectangles showing area progression",
        "params_schema": {}
      },
      {
        "method": "plotQuadratic",
        "description": "Graph the function 2n² + n with horizontal line at 2023",
        "params_schema": {
          "current_n": "number"
        }
      }
    ]
  },
  "nodes": [
    {
      "type": "act",
      "id": "act_setup",
      "title": "Visualizing the Problem",
      "objective": "Understand the nested circles construction and shading pattern",
      "context_from_previous": "Student is familiar with area of circles but hasn't seen this alternating ring pattern",
      "beat_outline": [
        {
          "narration_hint": "Let's start with the given example of 8 nested circles",
          "card_type": "none",
          "viz_actions": [
            "drawCircle"
          ],
          "inline_at_end": false
        },
        {
          "narration_hint": "Now we'll shade every other ring, starting between radius 1 and 2",
          "card_type": "none",
          "viz_actions": [
            "highlightRing"
          ],
          "inline_at_end": false
        }
      ],
      "viz_panel": "svg"
    },
    {
      "type": "gate",
      "id": "gate_pattern_check",
      "gate_type": "quiz",
      "after_act": "act_setup",
      "question_hint": "Which rings are shaded in our 8-circle example?",
      "wrong_path_hint": "Remember we shade every other ring starting with the first",
      "wrong_path_acts": [
        {
          "type": "act",
          "id": "act_shading_correction",
          "title": "Correcting the Shading Pattern",
          "objective": "Reinforce the every-other-ring selection rule",
          "context_from_previous": "Student incorrectly identified which rings are shaded",
          "beat_outline": [
            {
              "narration_hint": "Let's look carefully - we shade the first ring (1-2), then skip 2-3, then shade 3-4, etc.",
              "card_type": "none",
              "viz_actions": [
                "highlightRing"
              ],
              "inline_at_end": false
            }
          ],
          "viz_panel": "svg"
        }
      ]
    },
    {
      "type": "act",
      "id": "act_area_calculation",
      "title": "Calculating Ring Areas",
      "objective": "Derive the area formula for each shaded ring",
      "context_from_previous": "Student understands which rings are shaded but hasn't calculated their areas",
      "beat_outline": [
        {
          "narration_hint": "The area between radius k and k+1 is π(k+1)² - πk² = π(2k + 1)",
          "card_type": "latex",
          "viz_actions": [
            "showAreaFormula"
          ],
          "inline_at_end": false
        },
        {
          "narration_hint": "For our shaded rings (k=1,3,5,...), this gives areas of 3π, 7π, 11π,...",
          "card_type": "none",
          "viz_actions": [
            "highlightRing"
          ],
          "inline_at_end": false
        }
      ],
      "viz_panel": "svg"
    },
    {
      "type": "gate",
      "id": "gate_area_check",
      "gate_type": "quiz",
      "after_act": "act_area_calculation",
      "question_hint": "What's the area between radius 5 and 6?",
      "wrong_path_hint": "Remember the formula π(2k + 1) where k is the smaller radius",
      "wrong_path_acts": [
        {
          "type": "act",
          "id": "act_area_review",
          "title": "Reviewing Ring Area",
          "objective": "Clarify the area between two concentric circles",
          "context_from_previous": "Student used incorrect formula for annular area",
          "beat_outline": [
            {
              "narration_hint": "Let's visualize why it's π(k+1)² - πk², not just π(k+1 - k)",
              "card_type": "derivation",
              "viz_actions": [
                "highlightRing"
              ],
              "inline_at_end": false
            }
          ],
          "viz_panel": "svg"
        }
      ]
    },
    {
      "type": "act",
      "id": "act_summation",
      "title": "Summing the Shaded Areas",
      "objective": "Develop the total shaded area formula",
      "context_from_previous": "Student knows individual ring areas but hasn't summed them",
      "beat_outline": [
        {
          "narration_hint": "For n circles, we have n/2 shaded rings with areas following π(4m - 1) for m=1 to n/2",
          "card_type": "none",
          "viz_actions": [
            "stackRings"
          ],
          "inline_at_end": false
        },
        {
          "narration_hint": "This sum simplifies beautifully to π(2n² + n)",
          "card_type": "derivation",
          "viz_actions": [],
          "inline_at_end": true
        }
      ],
      "viz_panel": "svg"
    },
    {
      "type": "act",
      "id": "act_solution",
      "title": "Finding the Threshold",
      "objective": "Solve 2n² + n ≥ 2023 for the minimal n",
      "context_from_previous": "Student has the quadratic formula but needs to solve the inequality",
      "beat_outline": [
        {
          "narration_hint": "We need to find when 2n² + n first exceeds 2023",
          "card_type": "none",
          "viz_actions": [
            "plotQuadratic"
          ],
          "inline_at_end": false
        },
        {
          "narration_hint": "The solution n ≈ 31.8 means we need 32 circles to exceed the threshold",
          "card_type": "latex",
          "viz_actions": [],
          "inline_at_end": true
        }
      ],
      "viz_panel": "svg"
    },
    {
      "type": "marker",
      "label": "Conclusion",
      "after_act": "act_solution"
    }
  ]
}