{
  "meta": {
    "title": "Nested Circles Problem",
    "source": "Custom Math Lesson",
    "answer": "64",
    "estimated_duration_minutes": 15
  },
  "problem": {
    "text": "An even number of circles are nested, starting with a radius of $1$ and increasing by $1$ each time, all sharing a common point. The region between every other circle is shaded, starting with the region inside the circle of radius $2$ but outside the circle of radius $1$. What is the **least number of circles** needed to make the total shaded area at least $2023\\pi$?",
    "highlight": "Find the least number of circles for at least $2023\\pi$ shaded area."
  },
  "viz_requirements": {
    "type": "preset_coord_plane",
    "description": "Coordinate plane with nested circles and shaded areas.",
    "config": {},
    "actions": [
      {
        "method": "drawCircles",
        "description": "Draw nested circles with increasing radii.",
        "params_schema": {
          "params": "1 to n"
        }
      },
      {
        "method": "showAreaFormula",
        "description": "Reveal area formulas for each circle.",
        "params_schema": {
          "params": "{r}"
        }
      },
      {
        "method": "highlightDifference",
        "description": "Highlight the shaded area between circles.",
        "params_schema": {}
      },
      {
        "method": "drawGraph",
        "description": "Animate a graph showing the relationship between n and shaded area.",
        "params_schema": {
          "params": "{n, shadedArea}"
        }
      },
      {
        "method": "highlightInequality",
        "description": "Emphasize the inequality for determining minimum circles.",
        "params_schema": {}
      }
    ]
  },
  "nodes": [
    {
      "type": "act",
      "id": "act_introduction",
      "title": "Introduction to Nested Circles",
      "objective": "Introduce the concept of nested circles.",
      "context_from_previous": "Students are familiar with basic geometry and area formulas.",
      "beat_outline": [
        {
          "narration_hint": "Let’s visualize circles nested together, each increasing by one radius.",
          "card_type": "none",
          "viz_actions": [
            "drawCircles(params: {1 to 4})"
          ],
          "inline_at_end": false
        }
      ],
      "viz_panel": "svg"
    },
    {
      "type": "act",
      "id": "act_area_calculation",
      "title": "Area of Circles",
      "objective": "Explain how to calculate the area of a circle.",
      "context_from_previous": "Students have seen the introduction to nested circles.",
      "beat_outline": [
        {
          "narration_hint": "The area of a circle is calculated using A = πr².",
          "card_type": "latex",
          "viz_actions": [
            "showAreaFormula(params: {1})",
            "showAreaFormula(params: {2})"
          ],
          "inline_at_end": false
        }
      ],
      "viz_panel": "svg"
    },
    {
      "type": "act",
      "id": "act_shaded_area_calculation",
      "title": "Shaded Area Calculation",
      "objective": "Derive the shaded area between circles.",
      "context_from_previous": "Students understand how to calculate the area of a circle.",
      "beat_outline": [
        {
          "narration_hint": "The shaded area is the difference between the areas of two circles.",
          "card_type": "none",
          "viz_actions": [
            "highlightDifference()"
          ],
          "inline_at_end": false
        }
      ],
      "viz_panel": "svg"
    },
    {
      "type": "act",
      "id": "act_summing_shaded_areas",
      "title": "Summing Up the Shaded Areas",
      "objective": "Introduce the concept of summing shaded areas.",
      "context_from_previous": "Students have learned how to calculate individual shaded areas.",
      "beat_outline": [
        {
          "narration_hint": "Now, let's sum the areas of all shaded regions.",
          "card_type": "none",
          "viz_actions": [
            "drawShadedAreaBlocks(params: {1, 2, 3, 4})"
          ],
          "inline_at_end": false
        }
      ],
      "viz_panel": "svg"
    },
    {
      "type": "act",
      "id": "act_final_area_formula",
      "title": "Final Area Formula",
      "objective": "Present the total shaded area formula.",
      "context_from_previous": "Students understand the concept of summing shaded areas.",
      "beat_outline": [
        {
          "narration_hint": "We can now express the total shaded area as a formula.",
          "card_type": "latex",
          "viz_actions": [
            "showEquation(params: {totalShadedArea})"
          ],
          "inline_at_end": false
        }
      ],
      "viz_panel": "svg"
    },
    {
      "type": "act",
      "id": "act_minimum_circles",
      "title": "Finding the Minimum Circles",
      "objective": "Solve for the minimum number of circles needed for the shaded area.",
      "context_from_previous": "Students have learned the formula for the total shaded area.",
      "beat_outline": [
        {
          "narration_hint": "Let’s determine how many circles we need to reach at least 2023π in shaded area.",
          "card_type": "none",
          "viz_actions": [
            "highlightInequality()",
            "highlightFinalAnswer()"
          ],
          "inline_at_end": false
        }
      ],
      "viz_panel": "svg"
    },
    {
      "type": "gate",
      "id": "gate_area_calculation",
      "gate_type": "quiz",
      "after_act": "act_area_calculation",
      "question_hint": "What is the area of a circle with radius 3?",
      "wrong_path_hint": "Remember, area is calculated using the radius squared.",
      "wrong_path_acts": [
        {
          "type": "act",
          "id": "act_area_calculation",
          "title": "Area of Circles",
          "objective": "Explain how to calculate the area of a circle.",
          "context_from_previous": "Students have seen the introduction to nested circles.",
          "beat_outline": [
            {
              "narration_hint": "The area of a circle is calculated using A = πr².",
              "card_type": "latex",
              "viz_actions": [
                "showAreaFormula(params: {1})",
                "showAreaFormula(params: {2})"
              ],
              "inline_at_end": false
            }
          ],
          "viz_panel": "svg"
        }
      ]
    },
    {
      "type": "gate",
      "id": "gate_shaded_area_understanding",
      "gate_type": "quiz",
      "after_act": "act_shaded_area_calculation",
      "question_hint": "What is the shaded area between circles of radius 2 and 1?",
      "wrong_path_hint": "Ensure you are calculating the difference in areas.",
      "wrong_path_acts": [
        {
          "type": "act",
          "id": "act_shaded_area_calculation",
          "title": "Shaded Area Calculation",
          "objective": "Derive the shaded area between circles.",
          "context_from_previous": "Students understand how to calculate the area of a circle.",
          "beat_outline": [
            {
              "narration_hint": "The shaded area is the difference between the areas of two circles.",
              "card_type": "none",
              "viz_actions": [
                "highlightDifference()"
              ],
              "inline_at_end": false
            }
          ],
          "viz_panel": "svg"
        }
      ]
    },
    {
      "type": "gate",
      "id": "gate_minimum_circles",
      "gate_type": "quiz",
      "after_act": "act_minimum_circles",
      "question_hint": "How many circles are needed to achieve a shaded area of at least 2023π?",
      "wrong_path_hint": "Consider how the shaded area grows with more circles.",
      "wrong_path_acts": [
        {
          "type": "act",
          "id": "act_final_area_formula",
          "title": "Final Area Formula",
          "objective": "Present the total shaded area formula.",
          "context_from_previous": "Students understand the concept of summing shaded areas.",
          "beat_outline": [
            {
              "narration_hint": "We can now express the total shaded area as a formula.",
              "card_type": "latex",
              "viz_actions": [
                "showEquation(params: {totalShadedArea})"
              ],
              "inline_at_end": false
            }
          ],
          "viz_panel": "svg"
        }
      ]
    }
  ]
}