{
  "meta": {
    "title": "The Divisor Desert",
    "source": "55th Ukrainian National Mathematical Olympiad",
    "answer": "The interval contains 0 divisors.",
    "estimated_duration_minutes": 10
  },
  "problem": {
    "text": "Prove that the number m^4 + 1 has no divisors in the interval [m^2 - 2m, m^2 + 2m] for every natural m > 2.",
    "highlight": "Prove m^4 + 1 has no divisors in [m^2 - 2m, m^2 + 2m]"
  },
  "viz_requirements": {
    "type": "custom",
    "description": "A hybrid 1D number line and 2D floating algebraic workspace that supports morphing equations and cinematic zooms.",
    "config": {},
    "actions": [
      {
        "method": "zoom_number_line",
        "description": "Zooms the number line to a specific center and range.",
        "params_schema": {}
      },
      {
        "method": "draw_bracket",
        "description": "Draws a shaded bracket on the number line.",
        "params_schema": {}
      },
      {
        "method": "drop_factorization",
        "description": "Drops prime factors onto the number line.",
        "params_schema": {}
      },
      {
        "method": "morph_equation",
        "description": "Smoothly morphs one term into another using substitution.",
        "params_schema": {}
      },
      {
        "method": "draw_codivisor_arc",
        "description": "Draws an arc connecting a divisor to its co-divisor.",
        "params_schema": {}
      },
      {
        "method": "snap_and_dim",
        "description": "Snaps a fractional value to an integer and dims a region.",
        "params_schema": {}
      },
      {
        "method": "sweep_dial",
        "description": "Shows a parameter dialing up to a max value and snapping to integers.",
        "params_schema": {}
      },
      {
        "method": "run_gauntlet",
        "description": "Runs one of the three mathematical trap animations (mod clock, irrational error, or gap between pillars).",
        "params_schema": {}
      }
    ],
    "viewBox": "0 0 1000 600"
  },
  "nodes": [
    {
      "type": "act",
      "id": "act_1_needle",
      "title": "The Needle in the Haystack",
      "objective": "Ground the abstract variables in a concrete visual scale to show how narrow the search window is.",
      "context_from_previous": "Student has just read the problem statement.",
      "viz_panel": "svg",
      "beat_outline": [
        {
          "narration_hint": "Consider the number m^4 + 1. If m is 10, this is 10,001. We want to prove that this massive number has absolutely no divisors in a very specific, tiny window: the interval from m^2 - 2m to m^2 + 2m.",
          "card_type": "text",
          "viz_actions": [
            "zoom_number_line"
          ],
          "inline_at_end": false
        },
        {
          "narration_hint": "For m=10, that is the window between 80 and 120. Why this window? Because m^2 is roughly the square root of our massive number. We are looking for divisors right near the center.",
          "card_type": "text",
          "viz_actions": [
            "draw_bracket"
          ],
          "inline_at_end": false
        },
        {
          "narration_hint": "If we look at the actual prime factorization of 10,001, which is 73 times 137, both land just outside our shaded zone. Our job is to prove this zone is always completely empty for any m.",
          "card_type": "text",
          "viz_actions": [
            "drop_factorization"
          ],
          "inline_at_end": false
        }
      ]
    },
    {
      "type": "act",
      "id": "act_2_collapse",
      "title": "The Degree Collapse",
      "objective": "Show how to reduce the dividend using modular arithmetic.",
      "context_from_previous": "Student understands the search interval [m^2-2m, m^2+2m].",
      "viz_panel": "svg",
      "beat_outline": [
        {
          "narration_hint": "Testing every number is impossible. So let us define any number in this window as m^2 + a, where a is small. If m^2 + a divides m^4 + 1, we can use a trick.",
          "card_type": "latex",
          "viz_actions": [
            "morph_equation"
          ],
          "inline_at_end": false
        },
        {
          "narration_hint": "In the world modulo m^2 + a, m^2 is equivalent to -a. So m^4, which is just m^2 squared, becomes (-a)^2, or a^2.",
          "card_type": "derivation",
          "viz_actions": [
            "morph_equation"
          ],
          "inline_at_end": false
        },
        {
          "narration_hint": "Suddenly, our massive dividend m^4 + 1 shrinks down to just a^2 + 1. The problem transforms from impossible arithmetic to manageable algebra.",
          "card_type": "text",
          "viz_actions": [
            "morph_equation"
          ],
          "inline_at_end": false
        }
      ]
    },
    {
      "type": "gate",
      "id": "gate_1_mod",
      "gate_type": "quiz",
      "after_act": "act_2_collapse",
      "question_hint": "If m^2 + a divides m^4 + 1, we found it must also divide a^2 + 1. Using this exact same logic, if m + 3 divides m^2 + 10, what smaller number must m + 3 divide?",
      "wrong_path_hint": "Remember to substitute the equivalent value for the variable.",
      "label": "Polynomial Modulo Checkpoint"
    },
    {
      "type": "act",
      "id": "act_3_fold",
      "title": "The Co-Divisor Fold",
      "objective": "Prove we only need to check the right half of the interval.",
      "context_from_previous": "Student knows we are looking for divisors of the form m^2+a that divide a^2+1.",
      "viz_panel": "svg",
      "beat_outline": [
        {
          "narration_hint": "Divisors always come in pairs. If there is a divisor on the left side of m^2, its partner must be on the right side.",
          "card_type": "text",
          "viz_actions": [
            "draw_codivisor_arc"
          ],
          "inline_at_end": false
        },
        {
          "narration_hint": "Watch what happens if we take the far left edge of our window. The math shows its partner lands at exactly m^2 + 2m plus a tiny fraction.",
          "card_type": "derivation",
          "viz_actions": [
            "draw_codivisor_arc"
          ],
          "inline_at_end": false
        },
        {
          "narration_hint": "But divisors must be integers! So the partner is forced to be less than or equal to m^2 + 2m. This means we can completely ignore the left side. Any divisor there guarantees a partner on the right.",
          "card_type": "text",
          "viz_actions": [
            "snap_and_dim"
          ],
          "inline_at_end": false
        }
      ]
    },
    {
      "type": "act",
      "id": "act_4_squeeze",
      "title": "The Squeeze",
      "objective": "Bound the multiple r to 1, 2, or 3.",
      "context_from_previous": "Student knows we only need to check a > 0.",
      "viz_panel": "svg",
      "beat_outline": [
        {
          "narration_hint": "So we only care about a > 0. We know m^2 + a goes into a^2 + 1 perfectly, so let us call the integer multiple r.",
          "card_type": "latex",
          "viz_actions": [
            "morph_equation"
          ],
          "inline_at_end": false
        },
        {
          "narration_hint": "Let us look at the extremes. The biggest a can be is 2m. If we plug that in, the top is roughly 4m^2, and the bottom is roughly m^2. The ratio is 4!",
          "card_type": "derivation",
          "viz_actions": [
            "morph_equation"
          ],
          "inline_at_end": false
        },
        {
          "narration_hint": "Because r must be a whole number strictly less than 4, it can only possibly be 1, 2, or 3.",
          "card_type": "text",
          "viz_actions": [
            "sweep_dial"
          ],
          "inline_at_end": false
        }
      ]
    },
    {
      "type": "gate",
      "id": "gate_2_bound",
      "gate_type": "quiz",
      "after_act": "act_4_squeeze",
      "question_hint": "Why can't the integer multiple r be 4 or larger?",
      "wrong_path_hint": "Look at the maximum possible values for the numerator and denominator.",
      "label": "Bounding Checkpoint"
    },
    {
      "type": "act",
      "id": "act_5_gauntlet",
      "title": "The Gauntlet",
      "objective": "Disprove r=3, 2, 1 using three distinct mathematical concepts.",
      "context_from_previous": "Student knows r can only be 1, 2, or 3.",
      "viz_panel": "svg",
      "beat_outline": [
        {
          "narration_hint": "Three possibilities left. Let us run them through the gauntlet. If r=3, a^2 + 1 must be a multiple of 3. But perfect squares are never 1 less than a multiple of 3. Dead.",
          "card_type": "text",
          "viz_actions": [
            "run_gauntlet"
          ],
          "inline_at_end": false
        },
        {
          "narration_hint": "If r=2, algebra gives us (a-1)^2 = 2m^2. Take the square root, and you get square root of 2 equals a fraction. But square root of 2 is irrational! Dead.",
          "card_type": "text",
          "viz_actions": [
            "run_gauntlet"
          ],
          "inline_at_end": false
        },
        {
          "narration_hint": "Finally, r=1 simplifies to m^2 = a^2 - a + 1. But look at the number line of perfect squares. The value drops exactly into the uncrossable gap between (a-1)^2 and a^2. It can never be a square. Dead.",
          "card_type": "text",
          "viz_actions": [
            "run_gauntlet"
          ],
          "inline_at_end": false
        },
        {
          "narration_hint": "All possibilities fail. The interval is completely empty. Zero divisors.",
          "card_type": "text",
          "viz_actions": [
            "zoom_number_line"
          ],
          "inline_at_end": false
        }
      ]
    }
  ]
}